{
  "$schema": "https://json-schema.org/draft/2020-12/schema",
  "$id": "https://github.com/AI-flower/shuling/schemas/title-formula.schema.json",
  "title": "agent/knowledge-base/title-formulas.json[]",
  "description": "标题公式（v3.2+）。每条候选标题都可追溯到 formula_id + trigger + intent。03-daily-flow.md draft generation 使用，05/06 学习使用。注意：薯灵自有抽象公式集，不复制 dbskill 75 公式原文。详见 docs/plans/v3.2-creator-business-intelligence-plan.md §5.4。",
  "type": "object",
  "additionalProperties": false,
  "required": [
    "id",
    "category",
    "trigger",
    "template",
    "intent",
    "best_for",
    "avoid_for",
    "constraints"
  ],
  "properties": {
    "id": {
      "type": "string",
      "pattern": "^[a-z][a-z0-9_]*$",
      "minLength": 3,
      "description": "公式唯一 ID，小写蛇形。"
    },
    "category": {
      "type": "string",
      "enum": [
        "cognitive_conflict",
        "curiosity_gap",
        "loss_aversion",
        "identity_mirror",
        "number_anchor",
        "result_promise",
        "social_proof",
        "controversy"
      ],
      "description": "公式类别。cognitive_conflict=反常识误区纠正；curiosity_gap=信息缺口；loss_aversion=避坑警告；identity_mirror=身份代入；number_anchor=数字清单步骤；result_promise=结果时间变化；social_proof=案例 A→B 复盘；controversy=争议站队。"
    },
    "trigger": {
      "type": "string",
      "minLength": 1,
      "description": "心理触发器的中文描述（人类可读）。例：「打破已有认知」「损失规避」。一个公式归属一个 trigger。"
    },
    "template": {
      "type": "string",
      "minLength": 1,
      "description": "可填空的标题骨架，使用 {占位符} 形式。必须使用薯灵自有抽象表述，**不允许**与 dbskill 75 公式原文 trigram 相似度 > 0.6。"
    },
    "intent": {
      "type": "string",
      "enum": ["click", "save", "comment", "trust", "lead", "conversion", "series"],
      "description": "标题主要服务的目标。click=点击；save=收藏；comment=讨论；trust=建立专业度；lead=引导私信/索取资料；conversion=服务购买/报名；series=服务连续内容/账号资产。"
    },
    "best_for": {
      "type": "array",
      "minItems": 1,
      "items": { "type": "string", "minLength": 1 },
      "description": "最适合使用的内容场景或选题类型。1-3 条。"
    },
    "avoid_for": {
      "type": "array",
      "minItems": 1,
      "items": { "type": "string", "minLength": 1 },
      "description": "不建议套用的场景或选题类型。1-2 条。"
    },
    "constraints": {
      "type": "object",
      "additionalProperties": false,
      "required": ["max_chars", "needs_tension", "cooldown_posts"],
      "properties": {
        "max_chars": {
          "type": "integer",
          "minimum": 8,
          "maximum": 30,
          "description": "标题最大字符数（小红书首屏建议 ≤20，部分公式因结构占位允许放宽到 24）。"
        },
        "needs_tension": {
          "type": "boolean",
          "description": "是否需要张力（反差/冲突/疑问）。某些信息型公式可为 false。"
        },
        "cooldown_posts": {
          "type": "integer",
          "minimum": 0,
          "maximum": 10,
          "description": "同一 formula_id 在最近 N 条内容连续出现时降权（防模板化）。建议 2-4。"
        }
      },
      "description": "硬约束。max_chars 在小红书首屏裁剪点附近；cooldown_posts 由 06 学习使用。"
    },
    "notes": {
      "type": "string",
      "description": "公式补充说明（可选）。"
    }
  }
}
